source_id,title,authors,year,venue,category,discovered_via,doi,url,pdf_url,abstract,keywords,language,citation_count,source_type,access_rights,license_or_terms,local_path,status,notes
openalex_cd9440839782,Cheap Mix Design of the Rock-Filled Concrete Materials,Qiong Wu; Xue Hui An; Mian Huang,2013,Applied Mechanics and Materials,filling_capacity;dam_engineering,OpenAlex;Crossref,10.4028/www.scientific.net/amm.470.802,https://doi.org/10.4028/www.scientific.net/amm.470.802,,"Rock-filled concrete (RFC) is an innovative dam construction material that has been developed quickly in China since 2003. The concrete is produced by pouring the Self-compacting concrete (SCC) into the voids of large rock chunks, with a minimum size of 300 mm, in a formwork. To date, all the practical applications have shown that using RFC in dam constructions has significant economic and environmental benefits. Total construction cost is reduced due to using large amount of rock chunks, which can amount to roughly 55% of the total volume of RFC. When producing SCC, we make full use of local raw materials (e.g. fly ash, limestone) and optimize mix design based on the simple mini-slump flow tests on pastes to obtain better workability and lower cost. SCC with excellent workability can be obtained even the powder material is limestone powder alone. It is indicated that RFC is a potential and promising material for use in future concrete dams.",Formwork;Slump;Fly ash;Raw material;Volume (thermodynamics);Aggregate (composite);Geotechnical engineering;Superplasticizer;et al.,en,3,open_access_candidate,closed,https://www.scientific.net/PolicyAndEthics/PublishingPolicies; https://www.scientific.net/license/TDM_Licenser.pdf,,candidate,query=rock-filled concrete; query=rock filled concrete; query=self-compacting rock-filled concrete; query=rock-filled concrete; query=rock filled concrete
openalex_ae8505fceee9,Experimental study of filling capacity of self-compacting concrete and its influence on the properties of rock-filled concrete,Yuetao Xie; David J. Corr; Mohend Chaouche; Feng Jin; Surendra P. Shah,2013,Cement and Concrete Research,filling_capacity,OpenAlex;Crossref,10.1016/j.cemconres.2013.11.010,https://doi.org/10.1016/j.cemconres.2013.11.010,,,Clogging;Materials science;Microstructure;Geotechnical engineering;Aggregate (composite);Porosity;Composite material;Casting;et al.,en,62,open_access_candidate,closed,https://www.elsevier.com/tdm/userlicense/1.0/; https://www.elsevier.com/legal/tdmrep-license,,candidate,query=rock-filled concrete; query=rock filled concrete; query=self-compacting rock-filled concrete; query=rock-filled concrete; query=rock filled concrete; query=self-compacting rock-filled concrete; query=self-compacting concrete prepacked rock
openalex_7aedcecab3d2,Experimental study on I-IImixed mode fracture performance and influence of crack-depth of self-compacting rock-filled concrete,Haichao Wang,2013,,,OpenAlex,,https://openalex.org/W2360189484,,"An experiment on Ⅰ-Ⅱ mixed mode fracture performance of self-compacting rock-filled concrete was carried out by using large-size single incision four-point shearing beams with three different crack-depth ratios.The fracture mechanism of new technology material was researched and the fracture loads,initial loads,F-δ curve and crack initiation angles were measured in this experiment.The results showed that crack initiation angle increased obviously when crack-depth ratio ranges from 0.4 to 0.8,but it growed slowly when crack-depth ratio ranges from 0.8 to 1.2.",Shearing (physics); Fracture (geology); Materials science; Composite material; Geotechnical engineering; Crack growth resistance curve; Geology; Fracture mechanics; et al.,en,,open_access_candidate,closed,,,candidate,query=self-compacting rock-filled concrete
openalex_1d91bd965ec2,Experimental study on new technology of the construction waste concrete recycling,HE Shi-qin,2013,Concrete,mechanical_properties;dam_engineering,OpenAlex,,https://openalex.org/W2377400947,,"Some or all of the natural aggregate could be replaced by the recycled aggregate crushed with the waste concrete.The recycled concrete will be constructed with the recycled aggregate to realize the construction waste resource utilization.But it will bring about the problem of increased costs and secondary pollution.Based on the rock-filled concrete technology,a new technology of recycling of waste concrete was proposed.At first,the waste concrete was simply broken into large diameter aggregate to be prepacked the rock-filled body; and then the self-compacting concrete was poured into the rock-filled body to construct the new recycled rock-filled concrete.The experiment of the filling property of self compacting concrete and the compressive and tensile properties were carried out.Laboratory test results showed that using this technology a dense and high strength concrete structure could be easily constructed due to the self-compacting concrete could be used to fill the pores between the waste concrete.The recycled rock-filled concrete specimen may have a similar strength with self-compacting concrete when the pouring.The new technology of the renewable concrete proposed could realize the renewable resources and utilization of the waste concrete efficiently and economically.",Aggregate (composite);Compressive strength;Construction waste;Environmental pollution;Waste management;Environmental science;Materials science;Engineering;et al.,en,1,open_access_candidate,closed,,,candidate,query=self-compacting rock-filled concrete; query=self-compacting concrete prepacked rock
openalex_390aedc167ed,"Integrated evaluation of cost, schedule and emission performance on rock-filled concrete dam construction operation using discrete event simulation",Chunna Liu; Changbum R. Ahn; Xuehui An; Sang Hyun Lee,2013,2013 Winter Simulations Conference (WSC),numerical_modeling;dam_engineering,OpenAlex;Crossref,10.1109/wsc.2013.6721678,https://doi.org/10.1109/wsc.2013.6721678,,"Massive concrete dam projects will be conducted in the next ten years to respond to the increasing demand for clean energy and water resources in developing countries. With more attention paid to environmental issues, there is an increasing need to develop a methodology for reliably predicting the integrated performance of cost, schedule and emission factors in the planning stage. In this paper, we propose a methodology for using discrete event simulation (DES) for dam construction processes to enhance the performance dynamically. A case study is conducted to demonstrate the effectiveness of the DES model, which is validated by the actual cumulative progress on the construction site. The results indicate that the cost, schedule and emission performance are highly interactively correlated when using RFC in dam projects. The promoted methodology could help construction managers compare the integrated performance of different options in RFC dam constructions.",Schedule;Discrete event simulation;Computer science;Event (particle physics);Civil engineering;Engineering;Construction engineering;Simulation;et al.,en,6,open_access_candidate,closed,,,candidate,query=rock-filled concrete; query=rock filled concrete; query=rock-fill concrete dam; query=rock-filled concrete; query=rock filled concrete
openalex_2066083a158a,"Integrated evaluation of cost, schedule and emission performance on rock-filled concrete dam construction operation using discrete event simulation",Chunna Liu; Changbum R. Ahn; Xuehui An; Sang Hyun Lee,2013,,numerical_modeling;dam_engineering,OpenAlex,10.5555/2675983.2676367,https://doi.org/10.5555/2675983.2676367,,"Massive concrete dam projects will be conducted in the next ten years to respond to the increasing demand for clean energy and water resources in developing countries. With more attention paid to environmental issues, there is an increasing need to develop a methodology for reliably predicting the integrated performance of cost, schedule and emission factors in the planning stage. In this paper, we propose a methodology for using discrete event simulation (DES) for dam construction processes to enhance the performance dynamically. A case study is conducted to demonstrate the effectiveness of the DES model, which is validated by the actual cumulative progress on the construction site. The results indicate that the cost, schedule and emission performance are highly interactively correlated when using RFC in dam projects. The promoted methodology could help construction managers compare the integrated performance of different options in RFC dam constructions.",Schedule;Discrete event simulation;Civil engineering;Event (particle physics);Computer science;Engineering;Construction engineering;Simulation;et al.,en,3,open_access_candidate,closed,,,candidate,query=rock-filled concrete; query=rock filled concrete; query=rock-fill concrete dam
openalex_417f1e9115d9,Life-Cycle Assessment of Concrete Dam Construction: Comparison of Environmental Impact of Rock-Filled and Conventional Concrete,Chunna Liu; Changbum R. Ahn; Xuehui An; Sang Hyun Lee,2013,Journal of Construction Engineering and Management,review;numerical_modeling;dam_engineering,OpenAlex;Crossref,10.1061/(asce)co.1943-7862.0000752,https://doi.org/10.1061/(asce)co.1943-7862.0000752,,"Massive concrete dam projects will be constructed in the next 10 years to respond to the increasing demand for clean energy and water resources in developing countries. Because of their ample use of cement, these projects have a significant environmental impact, including the production of carbon dioxide (CO2) emissions. Rock-filled concrete (RFC) is an innovative dam construction method that promises better environmental performance than conventional concrete (CC) in the material production stage by saving a large amount of cement. However, the environmental loads throughout the entire life cycle of a dam must be quantified. Thus, this paper aims to evaluate the environmental loads in the lifetime of a dam and reveal the environmental impact of RFC relative to CC over the entire life cycle of a concrete dam. Through reviewing the limitations of the existing life-cycle assessment (LCA) models, a hybrid LCA model is applied to achieve this goal. The results from a case study of a concrete dam project in China are presented to demonstrate the environmental benefit of RFC throughout the lifetime of a dam. The results indicate that RFC reduces greenhouse gas emissions by approximately 64% and energy consumption by approximately 55% compared with CC. With regard to each life cycle stage, RFC decreased the CO2 emissions by 72% in material production, 25% in transportation, 51% in construction, and 15.6% in operation and maintenance. The conclusion is that RFC is more environmentally responsible throughout the life cycle of a dam’s, and that the environmental benefit of RFC may help to encourage decision makers to select the appropriate methods in the planning phase.",Life-cycle assessment;Greenhouse gas;Environmental impact assessment;Environmental science;Cement;Production (economics);Civil engineering;Energy consumption;et al.,en,54,open_access_candidate,closed,,,candidate,query=rock-filled concrete; query=rock filled concrete; query=rock-fill concrete dam; query=rock-filled concrete; query=rock filled concrete
openalex_c00d64ddcdb3,Measurement and Evaluation of the Thermal Expansion Coefficient of Rock-Filled Concrete,Jinting Wang; Shuo Wang; Feng Jin,2013,Journal of Testing and Evaluation,numerical_modeling,OpenAlex;Crossref,10.1520/jte20120293,https://doi.org/10.1520/jte20120293,https://dl.astm.org/jte/article-pdf/41/6/951/137114/10_1520_jte20120293.pdf,"Abstract Rock-filled concrete (RFC), formed by pouring self-compacting concrete (SCC) into rock blocks, is a newly developed type of mass concrete. It is important to determine its coefficient of thermal expansion (CTE) in engineering applications. In this study the CTE of RFC was determined for the first time using thermal expansion tests. RFC with three rock rates was measured at different ages. Meanwhile, the CTEs of SCC and rock blocks were experimentally tested for subsequent numerical simulation and theoretical analysis. The CTE of RFC was then evaluated numerically and theoretically based on the constituent materials. A three-dimensional finite element model was built for the numerical simulation of the thermal expansion tests of RFC. In addition, two composite models were used for the theoretical evaluation of the CTE of RFC based on the material parameters of SCC and rock blocks. The obtained numerical and theoretical CTE values agree well with the experimental CTE value. The numerical simulation and theoretical formulas can be used to estimate the CTE of RFC, thereby overcoming the high cost of complex experimental measurements.",Thermal expansion;Materials science;Computer simulation;Rock mass classification;Thermal;Geotechnical engineering;Finite element method;Composite material;et al.,en,11,open_access_candidate,closed,,,candidate,query=rock-filled concrete; query=rock filled concrete; query=self-compacting rock-filled concrete; query=rock-filled concrete; query=rock filled concrete
openalex_a57a41c884ec,Rock-filled concrete in the mass concrete temperature field analysis,Xiping Jiang,2013,Concrete,thermal_control;numerical_modeling,OpenAlex,,https://openalex.org/W2391808854,,"Under the same conditions,ordinary concrete and rock-filled concrete technology of mass concrete casting simulation,to them the distribution of the temperature field produced by cloud be compared,demonstrates the internal hydration heat of rock-filled concrete produced more less and also demonstrates low temperature than normal concrete and crack control of mass more effective.",Mass concrete;Rock mass classification;Geotechnical engineering;Casting;Materials science;Geology;Composite material,en,1,open_access_candidate,closed,,,candidate,query=rock-filled concrete; query=rock filled concrete
openalex_2204591f4b82,Selection of Rock-fill Concrete Dam Type of Mengman Second Cascade Hydropower Station,Peng Zhang-chao,2013,,thermal_control;dam_engineering,OpenAlex,,https://openalex.org/W2374306986,,"After comprehensive comparison,concrete gravity dam was the selected dam type in Mengman second cascade hydropower station ordinary concrete,roller compacted concrete and rock-filled concrete were analyzed and compared from sides of investment,construction condition,temperature control,environment protection and risks,rock-fill concrete gravity dam was recommend finally.",Gravity dam; Hydropower; Geotechnical engineering; Cascade; Roller-compacted concrete; Geology; Environmental science; Engineering; et al.,en,,open_access_candidate,closed,,,candidate,query=rock-fill concrete dam
openalex_99fb932846df,Study on Strength Mechanism of Self-Compacting Rock-Fill Concrete with Big Aggregates,Hai Chao Wang; Chun Ru Cheng; Xue Hui An,2013,Advanced materials research,mechanical_properties,OpenAlex;Crossref,10.4028/www.scientific.net/amr.753-755.558,https://doi.org/10.4028/www.scientific.net/amr.753-755.558,,"Self-compacting rock-fill concrete with natural and recycled aggregate can be applied in large structural components’production. According to the deep analysis of material's mechanical properties test data, the author makes a study on the strength mechanism of the concrete material. The results show that the concrete material essentially is concrete, and the concrete strength of large-sized natural aggregate and recycled aggregate are basically the same. However, due to the varieties in material production process and material shape as well as the influence of the mechanical properties and aggregate size, the strength mechanism of them is different. Effective control on mechanical properties of self-compacting rock-fill concrete and aggregate's appearances and shapes is helpful to the strength design of the self-compacting rock-fill concrete with large aggregate.",Aggregate (composite);Materials science;Geotechnical engineering;Composite material;Geology,en,0,open_access_candidate,closed,https://www.scientific.net/PolicyAndEthics/PublishingPolicies; https://www.scientific.net/license/TDM_Licenser.pdf,,candidate,query=self-compacting rock-filled concrete; query=self-compacting concrete prepacked rock
openalex_6553ac9cad70,Study on the Compression Capacity of the Wall of Recycled Aggregates Self-Compacting Rock-Filled Concrete,Hai Chao Wang; Yi Long Gao; Xue Hui An,2013,Applied Mechanics and Materials,mechanical_properties;dam_engineering,OpenAlex;Crossref,10.4028/www.scientific.net/amm.438-439.719,https://doi.org/10.4028/www.scientific.net/amm.438-439.719,,"The goal of the paper is to make good use of solid wastes. The aggregates of ordinary self-compacting concrete are changed for the large size of recycled aggregate, which are randomly put into the mold before self-compacting concrete are poured into to form the new type of concrete specimens, and a freestone aggregate specimen is also made for a comparison. 500 tons of electro-hydraulic servo testing machine is used for the test, to measure the strength of this new wall material, bearing capacity, deformation properties and damage form, etc. Test results show that the average compressive strength of the wall of recycled aggregate rock-filled concrete is 6.42MPa, which is far greater than 2.03MPa specified in standard under same mortar strength. Therefore, the recycled aggregate concrete wall of self-compacting has higher bearing capacity, and can meet the requirment of the project.",Aggregate (composite);Mortar;Compressive strength;Bearing capacity;Geotechnical engineering;Materials science;Deformation (meteorology);Compression (physics);et al.,en,0,open_access_candidate,closed,https://www.scientific.net/PolicyAndEthics/PublishingPolicies; https://www.scientific.net/license/TDM_Licenser.pdf,,candidate,query=self-compacting rock-filled concrete; query=rock-filled concrete; query=rock filled concrete; query=self-compacting rock-filled concrete
openalex_d9d8c6f3c9f3,The Research and Application of Dam Construction Technology of Rock-Filled Concrete,Jun Liu,2013,Applied Mechanics and Materials,dam_engineering,OpenAlex;Crossref,10.4028/www.scientific.net/amm.438-439.1347,https://doi.org/10.4028/www.scientific.net/amm.438-439.1347,,"The auxiliary dam of the upper reservoir of Baoquan pumped storage power station is filled with rock-filled concrete, which accelerates the schedule of construction, shortens the duration, reduces investment, and guarantees the quality of the construction effectively. This is the first application of rock-filled concrete in dam filling in hydraulic engineering, and it develops a new technology of using rock-filled concrete to fill dam, which provides valuable experience in the diversity and rationality of hydraulic engineering construction.",Schedule;Civil engineering;Geotechnical engineering;Duration (music);Engineering;Computer science;Operating system;Art;et al.,en,1,open_access_candidate,closed,https://www.scientific.net/PolicyAndEthics/PublishingPolicies; https://www.scientific.net/license/TDM_Licenser.pdf,,candidate,query=rock-filled concrete; query=rock filled concrete; query=rock-fill concrete dam; query=rock-filled concrete; query=rock filled concrete
openalex_9bedfe370565,Experimental study of the interfacial transition zone (ITZ) of model rock-filled concrete (RFC),Yuetao Xie; David J. Corr; Feng Jin; Hu Zhou; Surendra P. Shah,2014,Cement and Concrete Composites,,OpenAlex;Crossref,10.1016/j.cemconcomp.2014.09.002,https://doi.org/10.1016/j.cemconcomp.2014.09.002,,,Materials science;Grout;Nanoindentation;Rheology;Geotechnical engineering;Cement;Formwork;Aggregate (composite);et al.,en,186,open_access_candidate,closed,https://www.elsevier.com/tdm/userlicense/1.0/; https://www.elsevier.com/legal/tdmrep-license,,candidate,query=rock-filled concrete; query=rock filled concrete; query=self-compacting rock-filled concrete; query=rock-filled concrete; query=rock filled concrete
openalex_cea711e78c4e,Future research needs in self-consolidating concrete,Surendra P. Shah; Gilson R. Lomboy,2014,Journal of Sustainable Cement-Based Materials,filling_capacity;dam_engineering,OpenAlex,10.1080/21650373.2014.956238,https://doi.org/10.1080/21650373.2014.956238,,"The development of self-consolidating concrete (SCC) had revolutionized construction by its ability to achieve full compaction without mechanical vibration and consistency of quality. Use of SCC results in significant reduction in construction time, cost, and noise. With the growing utilization of SCC, the necessity for research to understand and manipulate the fresh and hardened properties of SCC also increases. The paper presents future research needs of SCC in the areas of rheology, construction, and sustainability. Aside from yield stress and viscosity, which are key properties for flowability and stability, the mechanisms behind thixotropy need to be understood. To be able to obtain a better grasp of the mechanisms driving the rheology of cement-based systems, the system needs to be studied at multiple scales. Three research areas in construction using SCC are discussed; pumping, cast-in-place of bridge components, and rock-filled concrete. Finally, the research need for further sustainability is emphasize.",Thixotropy; Rheology; Sustainability; Compaction; Engineering; Civil engineering; Materials science; Construction engineering; et al.,en,21,open_access_candidate,closed,,,candidate,query=self-compacting rock-filled concrete
openalex_21c90a50f3bb,Particle Size Distribution of Sandstone Aggregate Influence on Recycled Aggregate Concrete Properties,Li Zhou; Fang Ning Sun; Qing Hong Zhao,2014,Applied Mechanics and Materials,filling_capacity;mechanical_properties;numerical_modeling,OpenAlex,10.4028/www.scientific.net/amm.584-586.1504,https://doi.org/10.4028/www.scientific.net/amm.584-586.1504,,"Typically, the selection of large aggregate particle size is mainly determined by the thickness of structures and the thickness of protective layer. The greater the aggregate diameter is, the smaller the specific surface is, and the smaller coating materials demand will be without specific requirements. It will affect the concrete flowability directly if there are too much big size of aggregates or the particle size is too big for forming a certain stable packing skeleton structure. The strength of the large diameter recycled self-compacting rock-fill concrete is low so that the primary cause of its failure mechanism is bond failure and bond slip in aggregate. Shear failure in aggregate is not easy to happen due to the strength of the aggregate is too low. For this reason, we put forward the general selection requirements for large diameter aggregate.",Aggregate (composite); Materials science; Composite material; Particle size; Particle-size distribution; Particle (ecology); Geotechnical engineering; Geology; et al.,en,3,open_access_candidate,closed,,,candidate,query=self-compacting rock-filled concrete
openalex_320bd7105c06,"Rock-filled concrete, the new norm of SCC in hydraulic engineering in China",Xuehui An; Qiong Wu; Feng Jin; Miansong Huang; Hu Zhou; Changjiu Chen; Chunna Liu,2014,Cement and Concrete Composites,mechanical_properties;dam_engineering,OpenAlex;Crossref,10.1016/j.cemconcomp.2014.08.001,https://doi.org/10.1016/j.cemconcomp.2014.08.001,,"Rock-filled concrete (RFC) was developed in China in 2003 as an application of self-compacting concrete (SCC) that can then be used as “normal” concrete for massive concrete constructions. RFC is produced by filling the voids of rock blocks with SCC, which has good fluidity and segregation resistance. To guarantee the required workability of SCC, a mix design method for SCC based on its paste rheological characteristics was developed. The proposed method yielded practical benefits by saving on the amount of laboratory work, testing time, and raw materials. The integrated performance of RFC was studied by conducting tests on its compaction, compression strength, tensile strength, and permeability. Results indicated that RFC meets the requirements of hydraulic concrete. With two types of construction technology in practical application, RFC exhibits remarkable advantages, such as high construction efficiency, low cost, low heat of hydration, and low environmental load. These advantages contribute to a simpler construction management and an easier quality control, signifying that RFC is a promising technology in hydraulic engineering.",Compaction;Ultimate tensile strength;Compressive strength;Geotechnical engineering;Permeability (electromagnetism);Civil engineering;Materials science;Engineering;et al.,en,106,open_access_candidate,hybrid,cc-by,,candidate,query=rock-filled concrete; query=rock filled concrete; query=self-compacting rock-filled concrete; query=rock-filled concrete; query=rock filled concrete
