source_id,title,authors,year,venue,category,discovered_via,doi,url,pdf_url,abstract,keywords,language,citation_count,source_type,access_rights,license_or_terms,local_path,status,notes
openalex_fba87b5f2b60,A Comprehensive Literature Review on the Elastic Modulus of Rock-filled Concrete,Muhammad Ibrar Ihteshaam; Feng Jin,2024,Engineering Technology & Applied Science Research,review;thermal_control;mechanical_properties;numerical_modeling;dam_engineering,OpenAlex;Crossref,10.48084/etasr.7126,https://etasr.com/index.php/ETASR/article/download/7126/3731,https://etasr.com/index.php/ETASR/article/download/7126/3731,"Rock-Filled Concrete (RFC) is formed by pouring High-performance Self-Compacting Concrete (HSCC) into gaps between pre-placed rocks (that form a strong rock skeleton) in the formwork. An in-depth analysis of RFC's elastic modulus must focus on its static and elastic modulus behavior, strength characteristics, and sustainability aspects. Mesoscopic finite element modeling effectively incorporates pre-positioned rocks, Self-Compacting Concrete (SCC), and the Interfacial Transition Zone (ITZ) to correctly predict performance. RFC is a promising alternative to traditional construction methods, offering combined advantages for masonry and concrete techniques while reducing cement usage. Studies continue to examine the creep properties of reinforced fiber composites, with promising signs of their effectiveness in reducing hydration heat and concrete shrinkage. Subaquatic conservation agents enhance environmental stewardship in wet situations. The elastic modulus of rock-filled concrete increases logarithmically, mostly influenced by the rock-fill composition. It is crucial to study the shape, size, and rock-fill ratio of rocks in RFC that impact its stability, strength, and resistance to static and dynamic loads. Irregularly shaped rocks can enhance interlocking and mechanical properties, while a well-graded mix of sizes improves compaction and uniformity. Studying these properties enables engineers to optimize design and construction for durability and performance.",Geotechnical engineering;Elastic modulus;Materials science;Composite material;Geology;Structural engineering;Engineering,en,7,open_access_candidate,gold,cc-by,,candidate,query=rock-filled concrete; query=rock filled concrete; query=self-compacting rock-filled concrete; query=rock-filled concrete; query=rock filled concrete
openalex_6166e484c744,A Mesoscale Comparative Analysis of the Elastic Modulus in Rock-Filled Concrete for Structural Applications,Muhammad Ibrar Ihteshaam; Feng Jin; Xiaorong Xu,2024,Buildings,filling_capacity;thermal_control;mechanical_properties;numerical_modeling;dam_engineering,OpenAlex;Crossref,10.3390/buildings14103171,https://www.mdpi.com/2075-5309/14/10/3171/pdf?version=1728175948,https://mdpi-res.com/d_attachment/buildings/buildings-14-03171/article_deploy/buildings-14-03171.pdf,"Rock-filled concrete (RFC) is an advanced construction material that integrates high-performance self-compacting concrete (HSCC) with large rocks exceeding 300 mm, providing advantages such as reduced hydration heat and increased construction processes. The elastic modulus of RFC is a critical parameter that directly influences its structural performance, making it vital for modern construction applications that require strength and stiffness. However, there is a scientific gap in understanding the effects of rock size, shape, arrangement, and volumetric ratio on this parameter. This study investigates these factors using mesoscale finite element models (FEMs) with spherical and polyhedral rocks. The results reveal that polyhedral rocks increase the elastic modulus compared to spherical rocks, enhancing RFC’s load-bearing capacity. Additionally, a 5% increase in the elastic modulus was observed when the rockfill ratio was increased from 50% to 60%, demonstrating a direct correlation between rock volume and mechanical performance. Furthermore, the elastic modulus rises significantly in the early stages of placement, followed by a gradual increase over time. Optimal rock sizes and a balanced mix of rock shapes allow for improved concrete flow and mechanical properties, making RFC a highly efficient material for construction. These findings offer valuable insights for designers and engineers looking to optimize RFC for structural applications.",Mesoscale meteorology;Structural engineering;Elastic modulus;Materials science;Geotechnical engineering;Geology;Composite material;Engineering;et al.,en,5,open_access_candidate,gold,cc-by,,candidate,query=rock-filled concrete; query=rock filled concrete; query=self-compacting rock-filled concrete; query=rock-filled concrete; query=rock filled concrete
openalex_efad3c1378e6,Analyzing the filling performance parameters of self-compacted mortar in rock filled concrete,Mostafa M. Elsherbeny; Jin Feng; Yanjie Xu,2024,Construction and Building Materials,dam_engineering,OpenAlex;Crossref,10.1016/j.conbuildmat.2024.136581,https://doi.org/10.1016/j.conbuildmat.2024.136581,,,Mortar;Geotechnical engineering;Materials science;Geology;Composite material,en,11,open_access_candidate,closed,https://www.elsevier.com/tdm/userlicense/1.0/; https://www.elsevier.com/legal/tdmrep-license; https://doi.org/10.15223/policy-017; https://doi.org/10.15223/policy-037; https://doi.org/10.15223/policy-012; https://doi.org/10.15223/policy-029; https://doi.org/10.15223/policy-004,,candidate,query=rock-filled concrete; query=rock filled concrete; query=self-compacting rock-filled concrete; query=rock-filled concrete; query=rock filled concrete
openalex_591e530bbec5,Force-electric characteristics of model rock-filled concrete under uniaxial compression with different curing ages and rock-filled ratios,Cheng Hua; Xiaochun Lu; Tao Luo,2024,The Science of The Total Environment,mechanical_properties,OpenAlex;Crossref,10.1016/j.scitotenv.2024.175462,https://doi.org/10.1016/j.scitotenv.2024.175462,,,Electrical resistivity and conductivity;Materials science;Porosity;Curing (chemistry);Composite material;Compressive strength;Geotechnical engineering;Electrical resistance and conductance;et al.,en,8,open_access_candidate,closed,https://www.elsevier.com/tdm/userlicense/1.0/; https://www.elsevier.com/legal/tdmrep-license; https://doi.org/10.15223/policy-017; https://doi.org/10.15223/policy-037; https://doi.org/10.15223/policy-012; https://doi.org/10.15223/policy-029; https://doi.org/10.15223/policy-004,,candidate,query=rock-filled concrete; query=rock filled concrete; query=rock-filled concrete; query=rock filled concrete
openalex_59c8660cc9c9,Heterogeneous temperature characteristics considering rainfall effect during construction of an integrally-poured rock-filled concrete arch dam,Xiaorong Xu; Anrui Xiao; Yulong Zhu; Chao Xu; Lin Zhang; Feng Jin,2024,Construction and Building Materials,thermal_control;dam_engineering,OpenAlex,10.1016/j.conbuildmat.2024.138626,https://doi.org/10.1016/j.conbuildmat.2024.138626,,,Integrally closed;Arch dam;Arch;Geotechnical engineering;Structural engineering;Geology;Environmental science;Materials science;et al.,en,5,open_access_candidate,closed,,,candidate,query=rock-filled concrete; query=rock filled concrete; query=rock-fill concrete dam; query=self-compacting rock-filled concrete
openalex_601bbd6003e0,Identification and characteristic analysis of internal defects in rock-filled concrete based on deep learning method,Tao Ren; Yufan Zhang; Tao Yang; Qiaolin Chen; Yu Lei; Guoji Wang; Meizhou Song,2024,Materials Today Communications,,OpenAlex,10.1016/j.mtcomm.2024.110652,https://doi.org/10.1016/j.mtcomm.2024.110652,,,Materials science;Identification (biology);Composite material;Forensic engineering;Engineering;Botany;Biology,en,3,open_access_candidate,closed,,,candidate,query=rock-filled concrete; query=rock filled concrete
crossref_e8a2d65f65dc,Influencing Factors and Research Progress of Thermal Conductivity of Rock-Fill Concrete,一鸣 梁,2024,Hans Journal of Civil Engineering,filling_capacity,Crossref,10.12677/hjce.2024.139191,https://doi.org/10.12677/hjce.2024.139191,,,,en,0,open_access_candidate,metadata,,,candidate,query=堆石混凝土; query=自密实堆石混凝土; query=金峰 堆石混凝土
openalex_e735933c7ec9,Mesoscopic representation of conventional concrete and rock-filled concrete: A novel FEM-SBFEM coupled approach,Weichi Xu; Yuande Zhou; Yutai Guo; Feng Jin,2024,Computers and Geotechnics,review;mechanical_properties;numerical_modeling;dam_engineering,OpenAlex;Crossref,10.1016/j.compgeo.2024.106820,https://doi.org/10.1016/j.compgeo.2024.106820,,"A thorough characterization of the mesostructure of concrete serves as a fundamental cornerstone for investigating its complex mechanical response at the mesoscale . A coupled FEM-SBFEM (Finite element method − scaled boundary finite element method) model is developed for mesoscopic modeling of conventional concrete (CC) and rock-filled concrete (RFC). This model incorporates a novel RAM (Random Aggregate Model) generation procedure based on Laguerre tessellation, allowing for the construction of coarse polyhedral aggregates with diverse grading schemes and adjustable aggregate volume fractions. Moreover, a framework has been developed for the automatic generation of prelaid rock skeletons , which accurately encapsulate the distinctive self-sustaining skeletal characteristics inherent to RFC. In a departure from conventional FEM, the SBFEM in this approach discretizes each coarse aggregate using a singular polyhedral element, resulting in a significant reduction in degrees of freedom. The proposed mesoscopic construction method is adopted for the prediction of elastic properties for both CC and RFC. Numerical samples of 48 CC specimens and 13 RFC specimens, with various aggregate volume fractions and rockfill ratios, are constructed using Monte Carlo simulations, and the results are compared with experimental and numerical data in literature. Statistical analyses are performed to investigate the impacts of aggregate volume fraction and anisotropic behavior on the elastic properties of CC and RFC. The results demonstrate that RFC exhibited an elastic modulus approximately 7.32 % higher than CC at the same coarse aggregate volume fractions. Furthermore, RFC exhibits a more substantial degree of anisotropy than CC. The proposed FEM-SBFEM coupled approach presents the capability to accurately predict the elastic behavior of concrete materials , and can be extended for a comprehensive investigation of the linear and nonlinear properties of actual RFC that comprises extremely coarse aggregates.",Mesoscopic physics;Finite element method;Representation (politics);Structural engineering;Materials science;Geotechnical engineering;Engineering;Physics;et al.,en,8,open_access_candidate,hybrid,cc-by,,candidate,query=rock-filled concrete; query=rock filled concrete; query=rock-filled concrete; query=rock filled concrete
crossref_3892f3523c07,Research on Damage Characterization of Rock-filled Concrete with Defects Using Super Absorbent Polymer,Yunke Liu; Guoji Wang; Tao Yang; Haoyang Qiao; Lei Yu; Tao Ren,2024,,mechanical_properties;numerical_modeling;dam_engineering,Crossref,10.21203/rs.3.rs-5109210/v1,https://doi.org/10.21203/rs.3.rs-5109210/v1,,"Abstract Rock-filled concrete (RFC) construction technology is to construct a force-transferring skeleton with large-size rocks, and to use self-compacting concrete (SCC) as the filling and bonding material, in which the defects with different distributions and sizes contained in SCC are often the key factors determining the mechanical properties and damage behaviors of RFC. In this research, by utilizing the excellent properties of super absorbent polymer (SAP), such as water absorption and expansion and dehydration shrinkage, non-introduction of impurities, and not easy suspension or settlement in concrete, RFC and SCC specimens with different numbers and sizes of defects were precisely prepared and subjected to unconfined uniaxial compression physical tests. The effects of porosity and pore aperture on the compressive strength and damage pattern of the specimens were studied. The mechanical behavior of the defective concrete specimens under compressive loading was analyzed from a microscopic perspective by using a combination of physical tests and numerical simulation using the Realistic Failure Process Analysis (RFPA) method to reveal the internal damage phenomenon and damage destabilization mechanism of RFC and SCC. The results show that: SAP material can accurately construct concrete specimens with stable and uniform defects; under the same porosity and aperture, the compressive strength of RFC is greater than that of SCC; the compressive strength of the specimen decreases linearly with the growth of porosity for the same aperture, the compressive strength of the specimen decreases with the increase of aperture for the same porosity and the trend tends to be flat, and the sensitivity of the compressive strength to porosity is higher than that of aperture. In addition, it was found that the internal penetrating shear damage during the fracturing process of SCC was the core cause of the overall damage. For RFC, the tensile fracture that penetrated through the force transmission skeleton of the stacked rock was the key factor causing the overall instability.",,en,0,open_access_candidate,metadata,https://creativecommons.org/licenses/by/4.0/,,candidate,query=rock-filled concrete; query=rock filled concrete
openalex_fcefb7ba28d7,Seismic Behavior of Rock-Filled Concrete Dam Compared with Conventional Vibrating Concrete Dam Using Finite Element Method,Can Tang; X. Hou; Yanjie Xu; Feng Jin,2024,Infrastructures,seismic_response;numerical_modeling;dam_engineering,OpenAlex;Crossref,10.3390/infrastructures9020023,https://www.mdpi.com/2412-3811/9/2/23/pdf?version=1706624514,https://mdpi-res.com/d_attachment/infrastructures/infrastructures-09-00023/article_deploy/infrastructures-09-00023.pdf,"A rock-filled concrete (RFC) dam is an original dam construction technology invented in China nearly 20 years ago. The technology has been continuously improved and innovated upon, and the accumulated rich practical experience gradually formed a complete dam design and construction technology. Seismic design is a key design area for RFC dams that still requires more investigation; therefore, this article attempts to address some questions in this area. In the article, the seismic design for a curved gravity dam, currently under construction, is compared for RFC and conventional vibrating concrete (CVC) dam alternatives based on American design documents. The conclusions drawn from investigations include the following: The displacement and stress distributions in both the CVC and RFC alternatives are similar, but the maximum computed values for the RFC dam model are slightly smaller than those for the CVC one, while the sliding resistance of both dam alternatives can meet the requirements of the specifications. Regarding the nonlinear seismic analysis results, the extent of damage in the RFC dam model is significantly reduced when compared with the CVC model, which can be explained by the higher cracking resistance of RFC. In general, the seismic performance of the investigated dam made of RFC appears to be better than that of CVC.",Finite element method;Geotechnical engineering;Geology;Structural engineering;Engineering,en,2,open_access_candidate,gold,cc-by,,candidate,query=rock-filled concrete; query=rock filled concrete; query=rock-fill concrete dam; query=rock-filled concrete; query=rock filled concrete; query=rock-fill concrete dam
openalex_d0e7c9afc2fa,Shear tests and meso-scale simulation of cold joint structures in rock-filled concrete: Considering the mutual contact effects between component materials,M.X. Zhang; Xiao-ling Tang; You-bin Li; Ning Liu; Tao Yang,2024,Construction and Building Materials,mechanical_properties;numerical_modeling;dam_engineering,OpenAlex,10.1016/j.conbuildmat.2024.138768,https://doi.org/10.1016/j.conbuildmat.2024.138768,,,Direct shear test;Shear (geology);Materials science;Joint (building);Component (thermodynamics);Geotechnical engineering;Composite material;Shear strength (soil);et al.,en,11,open_access_candidate,closed,,,candidate,query=rock-filled concrete; query=rock filled concrete; query=self-compacting rock-filled concrete
openalex_7937f8da769e,Study on compressive size effect of rock-filled concrete considering initial pores,Yu Lei; Guoji Wang; Tao Ren; Tao Yang; Qiaolin Chen; Meizhou Song,2024,Structures,mechanical_properties,OpenAlex;Crossref,10.1016/j.istruc.2024.108030,https://doi.org/10.1016/j.istruc.2024.108030,,,Compressive strength;Materials science;Geotechnical engineering;Composite material;Structural engineering;Geology;Engineering,en,7,open_access_candidate,closed,https://www.elsevier.com/tdm/userlicense/1.0/; https://www.elsevier.com/legal/tdmrep-license,,candidate,query=rock-filled concrete; query=rock filled concrete; query=self-compacting rock-filled concrete; query=rock-filled concrete; query=rock filled concrete
openalex_b470a7cd188a,Study on the effect of porosity and aperture on the damage characterization of rock-filled concrete (RFC),Yunke Liu; Guoji Wang; Tao Yang; Haoyang Qiao; Yu Lei; Tao Ren,2024,Scientific Reports,mechanical_properties;numerical_modeling;dam_engineering,OpenAlex,10.1038/s41598-024-80149-z,https://www.nature.com/articles/s41598-024-80149-z.pdf,https://www.nature.com/articles/s41598-024-80149-z.pdf,"Rock-filled concrete (RFC) construction technology is to construct a force-transferring skeleton with large-size rocks, and to use self-compacting concrete (SCC) as the filling and bonding material. In which the defects with different distributions and sizes contained in SCC are often the key factors determining the mechanical properties and damage behaviors of RFC. In this research, by utilizing the excellent properties of super absorbent polymer (SAP), such as water absorption and expansion and dehydration shrinkage, non-introduction of impurities, and not easy suspension or settlement in concrete, RFC and SCC specimens with different numbers and sizes of defects were precisely prepared and subjected to unconfined uniaxial compression physical tests. The effects of porosity and pore aperture on the compressive strength and damage pattern of the specimens were studied. The mechanical behavior of the defective concrete specimens under compressive loading was analyzed from a mesoscopic perspective by using a combination of physical tests and numerical simulation using the Realistic Failure Process Analysis (RFPA) method to reveal the internal damage phenomenon and damage destabilization mechanism of RFC and SCC. The results show that: SAP material can accurately construct concrete specimens with stable and uniform defects; under the same porosity and aperture, the compressive strength of RFC is greater than that of SCC; the compressive strength of the specimen decreases linearly with the growth of porosity for the same aperture, the compressive strength of the specimen decreases with the increase of aperture for the same porosity and the trend tends to be flat, and the sensitivity of the compressive strength to porosity is higher than that of aperture. In addition, it was found that the internal penetrating shear damage during the fracturing process of SCC was the core cause of the overall damage. For RFC, the tensile fracture that penetrated through the force transmission skeleton of the stacked rock was the key factor causing the overall instability.",Compressive strength;Materials science;Porosity;Composite material;Mesoscopic physics;Shrinkage;Compression (physics);Quantum mechanics;et al.,en,6,open_access_candidate,gold,cc-by-nc-nd,,candidate,query=rock-filled concrete; query=rock filled concrete; query=self-compacting rock-filled concrete
crossref_8ab665395dac,Temperature Simulation and Modeling Analysis of Rockfill Concrete Dams Based on Finite Element,勇超 杜,2024,Hans Journal of Civil Engineering,thermal_control;numerical_modeling;dam_engineering;filling_capacity,Crossref,10.12677/hjce.2024.138174,https://doi.org/10.12677/hjce.2024.138174,,,,en,0,open_access_candidate,metadata,,,candidate,query=堆石混凝土; query=自密实堆石混凝土; query=金峰 堆石混凝土
openalex_df2e2bccdbcd,The Influence of Construction Parameters on the Temperature Field of Rock-Filled Concrete,Juanjuan Quan; Zhuang Miao; Haipeng Yang; Tao Luo; Tianqi Zhang; Gang Li,2024,Buildings,thermal_control;dam_engineering,OpenAlex;Crossref,10.3390/buildings14123985,https://www.mdpi.com/2075-5309/14/12/3985/pdf?version=1734325336,https://mdpi-res.com/d_attachment/buildings/buildings-14-03985/article_deploy/buildings-14-03985.pdf,"This paper investigates the distribution characteristics and variation rules of the temperature field of rock-filled concrete during pouring. Based on the thermal model accounting for the hydration rate, it uses ANSYS software to study the influence rules of construction parameters, such as the rock-filled ratio, time between pours, pouring thickness at the peak value of rising temperature, temperature difference in the core and surface, and the position of the peak value of rising temperature during the construction of rock-filled concrete. The results indicate that, under varied rock-filled ratios, time between pours, and pouring thicknesses, the variation rules of the peak value of rising temperature, temperature difference in the core and surface, and the position of the peak value of rising temperature are the same. As the rock-filled ratio increases, the peak value of rising temperature and the temperature difference in the core and surface decrease, and the variation range of the position of the peak value of rising temperature enlarges as the number of pouring layers increases. When the time between pours is extended, both the peak value of rising temperature and the temperature difference in the core and surface decrease, and the fluctuation amplitude of the position of the peak value of rising temperature increases with the number of pouring layers. With the increase in the pouring thickness, the peak value of rising temperature and the temperature difference in the core and surface increase, and the position of the peak value of rising temperature does not change significantly with an increase in pouring layers. The maximums of the peak value of rising temperature and temperature difference in the core and surface are 15.56 °C and 14.54 °C, respectively, which meet the requirements of the specifications. The peak value of rising temperature has a linear relationship with the pouring layers. Therefore, constructing a hundred-meter-high dam is possible by controlling construction parameters, such as the rock-filled ratio, time between pours, and time between pours without taking temperature control measures.",Materials science;Core (optical fiber);Position (finance);Amplitude;Thermal;Atmospheric temperature range;Composite material;Thermodynamics;et al.,en,1,open_access_candidate,gold,cc-by,,candidate,query=rock-filled concrete; query=rock filled concrete; query=rock-filled concrete; query=rock filled concrete
openalex_cb87afadcee5,Void effect study on the compressive behavior of RFC based on the 3D four-phase mesoscopic finite element model,Yanpei Wang; Ting Liang; Feng Jin,2024,Construction and Building Materials,mechanical_properties;numerical_modeling;dam_engineering,OpenAlex,10.1016/j.conbuildmat.2024.135145,https://doi.org/10.1016/j.conbuildmat.2024.135145,,,Mesoscopic physics; Finite element method; Materials science; Void (composites); Compressive strength; Phase (matter); Composite material; Structural engineering; et al.,en,16,open_access_candidate,closed,,,candidate,query=self-compacting rock-filled concrete
openalex_6dba09b9a80e,堆石混凝土技术在水利工程大坝中的应用,黄小波,2024,工程学研究与实用,dam_engineering;filling_capacity,OpenAlex;Crossref,10.37155/2717-5316-0518-1,https://doi.org/10.37155/2717-5316-0518-1,,,Philosophy,zh,0,open_access_candidate,diamond,,,candidate,query=堆石混凝土; query=堆石混凝土; query=自密实堆石混凝土; query=金峰 堆石混凝土
openalex_18a86c5d3e4c,探析水利混凝土工程的施工要点及其裂缝控制,也 贾,2024,水电科技,dam_engineering,OpenAlex,10.33142/hst.v7i6.12523,https://journals.viserdata.com/index.php/hst/article/download/12523/12363,https://journals.viserdata.com/index.php/hst/article/download/12523/12363,水利混凝土工程在施工过程中常常面临着裂缝问题，不仅会影响工程的结构安全性，还会导致水渗漏等问题。文章主要探讨水利混凝土工程的施工要点，包括混凝土浇筑、绿化混凝土技术、堆石混凝土技术、搅拌混凝土技术和混凝土养护施工技术等方面，再重点讨论水利混凝土工程中的裂缝控制方法，主要是从施工操作、施工材料择、结构设计和加固等方面展开分析，以提高水利混凝土工程的施工质量，减少裂缝的产生，确保工程的安全稳定性。,Computer science,zh,,open_access_candidate,diamond,cc-by-nc,,candidate,query=堆石混凝土
