source_id,title,authors,year,venue,category,discovered_via,doi,url,pdf_url,abstract,keywords,language,citation_count,source_type,access_rights,license_or_terms,local_path,status,notes
openalex_93b840d9b752,Behavior of Self-compacting Rock-fill Concrete Beam under Normal Section Stressing,Jianjun Shi,2005,Jorunal of Water Resources and Architectural Engingeering,,OpenAlex,,https://openalex.org/W2361619819,,"In order to study the behavior of the self-compacting rock-fill concrete beam under static load,two tests of the three-dividing point loading are done.The behavior of the self-compacting rock-fill concrete beam under normal section stressing is analyzed in detail.The experiment proves that the integrity of the self-compacting rock-fill concrete beam is well and the assumption of the horizontal section is suit to the study on the self-compacting rock-fill concrete beam.",Beam (structure);Section (typography);Geotechnical engineering;Structural engineering;Point (geometry);Geology;Engineering;Computer science;et al.,en,1,open_access_candidate,closed,,,candidate,query=rock-filled concrete; query=rock filled concrete; query=self-compacting rock-filled concrete
openalex_04f0066b8bcc,Experiment on Self-Compacting Concrete Filling Rock-Fill,Shi Jing-jun,2005,Journal of Central-south Institute of Technology,filling_capacity;mechanical_properties,OpenAlex,,https://openalex.org/W2359924054,,"The self-compacting concrete, as a kind of high-performance concrete, is widely used at home. So if the self compacting concrete is filled with rock-fill, and its characteristic of high performance, no-vibration,self-compacting,etc. are exerted fully, it will receive excellent rock-fill concrete of comprehensive performance, and it is a kind of promissing new-type concrete.The authors study the flowing and filling about the self-compacting concrete which is filled with rock-fill, and show that it is feasible with self-compacting concrete which is filled with rock-fill. The experiment has reached the anticipated result.",Geotechnical engineering; Types of concrete; Materials science; Geology; Composite material; Compressive strength,en,1,open_access_candidate,closed,,,candidate,query=self-compacting rock-filled concrete
openalex_a3d151cf0506,Experimental study of Self-Compacting Concrete filled prepacked rock,AN Xuehui,2005,Concrete,mechanical_properties;numerical_modeling;dam_engineering,OpenAlex,,https://openalex.org/W2387255985,,"In this paper,by using the self-compacting ability of SCC,based on existing construction method of prepacked aggregate concrete,a new construction method of Self-Compacting Concrete filled prepacked rock has been proposed.The prepacked rock body is filled with SCC to form a new type of concrete (RFC,rock filled concrete).An experimental method has been proposed to study the possibility of SCC filled prepacked rock,and to verify the hardening property of RFC.The prepacked rock filling experiment has been carried out,using specially designed low cement dosage SCC.The verification of filling up result and strength testing results demonstrate the practical future of RFC construction method.",Aggregate (composite);Hardening (computing);Cement;Geotechnical engineering;Geology;Materials science;Composite material;Layer (electronics),en,8,open_access_candidate,closed,,,candidate,query=rock-filled concrete; query=rock filled concrete; query=self-compacting rock-filled concrete; query=self-compacting concrete prepacked rock
openalex_0c0b0b985d9c,Study on rock-fill concrete dam,Feng Jin,2005,,mechanical_properties;dam_engineering,OpenAlex,,https://openalex.org/W2377464461,,"A new type of concrete namely rock-fill concrete(RFC) is proposed.The concrete is constructed by pouring the self-compacting concrete into the rock-fill body.Laboratory test results show that by using this technology a dense and high strength concrete structure can be easily constructed.The possible new types of dam based on this technology,namely RFC arch dam/gravity dam,RFC Core Rock-fill dam and RFC Mixing dam,are investigated.",Gravity dam;Arch dam;Geotechnical engineering;Roller-compacted concrete;Geology;Engineering;Arch;Civil engineering;et al.,en,17,open_access_candidate,closed,,,candidate,query=rock-filled concrete; query=rock filled concrete; query=rock-fill concrete dam; query=self-compacting rock-filled concrete
openalex_f5d2faad7931,Testing the Self-compacting Rock-fill Concrete Strength by the Rebound Method,Jianjun Shi; Chuhan Zhang,2006,Nondestructive Testing,filling_capacity;mechanical_properties,OpenAlex,,https://openalex.org/W2353642955,,"The self-compacting rock-fill concrete(RFC) compressive strength can't be tested by the preformed test cubes because the size of the block stone is relatively large.The rebound method is a nondestructive testing method which can test the concrete compressive strength,and it is very convenient and dependable.The rebound method is used to test the compressive strength of two RFC specimens.Experimental results show that,① the homogeneous RFC can be formed by the self-compacting concrete flowing in the prepacked rock about 1.5m distance.② the RFC compressive strength measured by the rebound method is accurate and reliable.③ the cubic compressive strength of the self-compacting concrete can evaluate the 28 days compressive strength of RFC.",Compressive strength;Materials science;Homogeneous;Geotechnical engineering;Composite material;Geology;Mathematics;Combinatorics,en,0,open_access_candidate,closed,,,candidate,query=self-compacting rock-filled concrete; query=self-compacting concrete prepacked rock
openalex_4295af9e31ed,EXPERIMENTAL RESEARCH ON MECHANICAL BEHAVIOR OF SELF-COMPACTING ROCK-FILL CONCRETE,Chuhan Zhang,2007,Chinese journal of rock mechanics and engineering,review;filling_capacity;mechanical_properties;numerical_modeling;dam_engineering,OpenAlex,,https://openalex.org/W2364825947,,"Among the innovative techniques for construction of concrete dams,the self-compacting rock-fill concrete(RFC) appears to be a prospect of future development.The self-compacting RFC can be used in the hydraulic engineering such as rock-fill arch dam,cofferdam and port.Based on the laboratory testst,he mechanical properties of RFC are dealt with.At firstt,he self-compacting concrete(SCC) is filled to the rock,and two RFC test blocks(1 500 mm×500 mm×500 mm) are formed;and then the samples are cut from the RFC test blocks directly.The RFC test blocks are divided into 10 groups according to the filling direction of the self-compaction concrete.Every group is cut into three prismatic samples with size of 150 mm×150 mm×450 mm;and the cubic samples(150 mm×150 mm×150 mm) are cut from the prismatic samples.The cubic and prismatic axial compressive strength and the prismatic bending strength of RFC are also obtained from the tests.It is shown that the RFC specimen may have a similar strength with SCC when the pouring and flowing distance is controlled within 1 500 mm;the stress-strain relationship appears to be linear with only a minor amount of plastic strain;and the samples show a splitting fracture behavior.Fracture surfaces demonstrate good cohesion conditions at the concrete-rock interface.",Geotechnical engineering;Materials science;Compaction;Compressive strength;Cohesion (chemistry);Bending;Cofferdam;Composite material;et al.,en,4,open_access_candidate,closed,,,candidate,query=rock-filled concrete; query=rock filled concrete; query=self-compacting rock-filled concrete
openalex_9318b54fdcb1,Experimental research on the tensile performance of the self-compacting rock-filled concrete,Feng Jin,2007,Concrete,review;mechanical_properties;dam_engineering,OpenAlex,,https://openalex.org/W2378204619,,"Among the rock-filled arch bam,cofferdam,port,etc,the self-compacting rock-filled concrete (RFC) appears to be a prospect of future development.Tensile performance affects the quality,fractures and deformation of large dam in the action of the hydraulic pressure over a long period of time in the large dam concrete structure.By means of cutting the samples from the RFC test block directly,this test deals with the splitting tension strength and flexural strength of RFC and builds the relationship between the compressive and tensile strength,and gives out the relevant mathematics expression.This research is provided the reasonable mechanics parameter for engineering project.",Geotechnical engineering;Ultimate tensile strength;Compressive strength;Cofferdam;Tension (geology);Deformation (meteorology);Arch;Flexural strength;et al.,en,4,open_access_candidate,closed,,,candidate,query=rock-filled concrete; query=rock filled concrete; query=self-compacting rock-filled concrete
openalex_5acfed839970,A Pilot Study on Integrated Properties of Rock-Filled Concrete,Feng Jin,2008,Journal of Building Materials,mechanical_properties;dam_engineering,OpenAlex,,https://openalex.org/W2366850826,,"A new type of concrete named RFC(rock-filled concrete),which was based on the technology of SCC(self-compacting concrete),was developed in 2003,and it has already been employed in hydraulic engineering structures in China.A large scale RFC test block(2.0 m×(1.0 m×1.8 m)) with cold and hot joints was designed and constructed in the laboratory in order to study the integrate properties of RFC.Thirty-nine specimens with different sizes were cut from the different parts of the block,and the mechanical properties and durability of RFC were studied based on the experimental tests.The results suggest that: the prismatic axial compressive strength of RFC is higher than that of SCC used in RFC construction;the cold and hot joints are planes of weakness in the RFC block; and the permeation resistance index of RFC is high enough to satisfy the dam concrete in hydraulic engineering.",Materials science;Durability;Compressive strength;Block (permutation group theory);Geotechnical engineering;Composite material;Structural engineering;Engineering;et al.,en,13,open_access_candidate,closed,,,candidate,query=rock-filled concrete; query=rock filled concrete; query=self-compacting rock-filled concrete
openalex_c1711c4abc71,Preliminary study on temperature rise property of thermal insulation of rock-fill concrete,Xuehui An,2008,Water Resources and Hydropower Engineering,thermal_control;dam_engineering,OpenAlex,,https://openalex.org/W2362249076,,"The technique of rock-fill concrete for dam construction is a new dam construction technique with advantages of high construction speed,economic construction cost,environment-friendly construction and easy quality control etc.The temperature rise property of thermal insulation of rock-fill concrete is an important index to study the crack resistance property of the rock-fill concrete dam.A method to combine both the physical test on temperature rise property of thermal insulation of self-compacted concrete and the numerical test on temperature rise process of thermal insulation of rock-fill concrete is adopted herein to study the temperature rise property of thermal insulation of rock-fill concrete,for which a simplified calculation method is put forward as well.",Thermal insulation;Thermal;Geotechnical engineering;Property (philosophy);Materials science;Civil engineering;Engineering;Composite material;et al.,en,2,open_access_candidate,closed,,,candidate,query=rock-filled concrete; query=rock filled concrete
openalex_e009ef0607e5,"Rock-fill concrete, a new type of concrete",Fujia Jin; Hu Zhou; Xuexia An; Mengqi Huang,2008,,,OpenAlex,10.1201/9781439828410.ch170,https://doi.org/10.1201/9781439828410.ch170,,,Type (biology);Geotechnical engineering;Geology;Forensic engineering;Engineering;Paleontology,en,4,open_access_candidate,closed,,,candidate,query=rock-filled concrete; query=rock filled concrete
openalex_8d54bd0e6151,堆石混凝土技术“引发革命”——清华大学堆石混凝土专利技术将在第六届四川国际水电产业展览会上亮相,李文,2008,建材与装饰：上旬,dam_engineering,OpenAlex,,https://openalex.org/W907397951,,日前，记者从第六届四川国际水电产业展览会组委会获悉，由清华大学金峰、安雪晖教授研究并获得国家专利的堆石混凝土技术将于4月15日-18日在成都第六届四川国际水电产业展览会上亮相。这项技术的出现成为水利水电工程界关注的焦点，其突出的经济、快速、质量、安全、节能、环保等多项优势将与碾压混凝土技术一样，引发一场大体积混凝土施工的革命。,Computer science;Business,zh,0,open_access_candidate,closed,,,candidate,query=堆石混凝土; query=金峰 堆石混凝土
openalex_02ddc8020698,Experimental Research on Freeze-thaw Resistence Property and Impermeability for Rock-filled Concrete,Jianjun Shi,2009,Journal of University of South China,mechanical_properties;dam_engineering,OpenAlex,,https://openalex.org/W2390353849,,"The freeze-thaw resistance property and impermeability of RFC affect directly the safety and reliability of its structure.The author had conducted experimental research to the samples after testing the mechanical properties of the RFC exposed to freeze-and-thaw cycles and the impermeability under water pressure.The test results indicated that the bonding interface of the construction coldjoints was the main path of seepage,and the permeability of the cold joints was greater than that of thehotjoints;the splitting tensile strength and the compressive strength of the coldjoints were less than the splitting tensile strength of the hot joints,and the loss rate of strength was greater.",Ultimate tensile strength;Permeability (electromagnetism);Geotechnical engineering;Compressive strength;Materials science;Composite material;Structural engineering;Reliability (semiconductor);et al.,en,1,open_access_candidate,closed,,,candidate,query=rock-filled concrete; query=rock filled concrete
openalex_b9b69b1c7019,Meso-scale simulation and experimental study on self-compacted rock-fill concrete,Xinwei Tang,2009,,mechanical_properties;numerical_modeling,OpenAlex,,https://openalex.org/W2373849249,,"Based on meso-scale mechanics for concrete,the rock-fill concrete(RFC) is regarded as a type of three-component composite material composed of self-compacted concrete,rock and interfaces.A meso-scale simulation model for studying the mechanical properties of RFC is established.Experimental tests for determining the basic mechanical parameters and constitutive relations of the three components are designed and carried out.A set of four-point flexural beam tests for verifying the validity of the simulation model is conducted.The comparison of simulation result with experimental data indicates that the model is capable of predicting the complete fracture process of RFC flexural beam,the load-displacement relationship and fracture pattern are in good agreement with corresponding experimental results.",Flexural strength;Geotechnical engineering;Structural engineering;Displacement (psychology);Fracture (geology);Scale (ratio);Roller-compacted concrete;Beam (structure);et al.,en,2,open_access_candidate,closed,,,candidate,query=rock-filled concrete; query=rock filled concrete
openalex_e877ae87eb2f,堆（卵）石混凝土密实度检测方法的研究,樊愚; 王万兴,2009,Acta Scientiarum Naturalium Universitatis Sunyatseni,numerical_modeling,OpenAlex,,https://openalex.org/W77762984,,密实度是反映堆石混凝土强度、耐久性的重要指标，可通过孔隙率的检测来评定。通过采用多种检测方法可知：密实度计量分析法、钻孔取芯与芯样评定法、预埋管件无损检测法均能较准确的计算混凝土的孔隙率，超声波检测法只能宏观评定；密实度计量分析法实际操作比较困难，钻孔取芯与芯样评定法属于半破损检测；预埋管件无损检测首次将红外成像技术应用于混凝土的密实度检测之中，方法简单、造价低廉、数值准确，建议对其进行推广使用。,Computer science,ja,,open_access_candidate,closed,,,candidate,query=堆石混凝土
openalex_71b56ce5b96e,大体积堆石（卵石）混凝土内部温度的试验研究,张广泰; 潘定才; Liu Ming Qing,2009,建筑科学,thermal_control;dam_engineering,OpenAlex,,https://openalex.org/W2493035609,,大体积混凝土温度裂缝控制一直是工程界关注的问题。堆石混凝土单方水泥用量少，水化温升低，在控制大体积混凝土温度裂缝方面体现了独特的优越性。本研究以实际工程为依托，通过试验监测大体积堆石（卵石）混凝土的内部温度变化；经水化热计算分析，得出在进行大体积混凝土工程施工时，采用堆石混凝土施工技术可减少或免除混凝土的温控措施。,Political science,zh,,open_access_candidate,closed,,,candidate,query=堆石混凝土
openalex_7fceea6ce52a,Application of C20 self-compacting concrete within rock-filled concrete,Qing Liu,2010,Concrete,thermal_control;mechanical_properties,OpenAlex,,https://openalex.org/W2370612668,,"This text mainly introduced the application of C20 self-compacting concrete within rock-filled concrete,and then pass to experiment and research,the first step verified to compressive strength,impermeability and frost resistance of self-compacting concrete and compressive strength of rock-filled concrete sample.Finally,a summary of this research was summed up in this text.",Compressive strength; Geotechnical engineering; Frost (temperature); Geology; Materials science; Composite material,en,,open_access_candidate,closed,,,candidate,query=self-compacting rock-filled concrete
openalex_7bc623ea2981,The Experimental Study of Influence of Recycled Aggregates on Mechanical Property of Self-compacting Rock-filled Concrete,Lin Jiang,2010,,mechanical_properties,OpenAlex,,https://openalex.org/W2356476913,,"5 groups of recycled coarse aggregates rock-fill concrete prismoids are made in abandoned rubble,abandoned bricks and abandoned concrete blocks.The influence of recycled coarse aggregates of different types and dosages on the prismoids compressive strength,modulus of elasticity as well as peak strain is investigated.The results indicate that prismoids compressive strength and modulus of elasticity of recycled aggregates rock-fill concrete will be larger with recycled coarse aggregate strength is heightened,but will be diminish with the categories of recycled coarse aggregate are increased;peak strain gets smaller with less types and more uniform distribution of recycled coarse aggregate in the recycled aggregate rock-fill concrete.",Aggregate (composite);Rubble;Compressive strength;Materials science;Geotechnical engineering;Young's modulus;Elastic modulus;Properties of concrete;et al.,en,3,open_access_candidate,closed,,,candidate,query=rock-filled concrete; query=rock filled concrete; query=self-compacting rock-filled concrete
openalex_840dd921ce7e,"技术抗旱,浇筑真情--堆石混凝土技术援建西南水源工程",柳晓璎,2010,水利水电技术,,OpenAlex,,https://openalex.org/W1544477565,,过去大半年西南地区持续大旱和近期南方多地洪涝灾害牵动着各界人士的广泛关注，同时引起了水利工程界的积极思考与反思，加强水利工程的综合功能是解决重大灾情的必由之路，华实科技联合清华大学水利水电工程系发起西南灾区水利技术援建行动，提出为受灾省区免费提供堆石混凝土技术服务，为受灾省份各援建一项水源工程，提高水源保证能力，,Computer science,zh,,open_access_candidate,closed,,,candidate,query=堆石混凝土
openalex_22098aa1d49c,Experimental studies on shear properties of cold joints of rock-filled concrete,He Shiqin Linjun; Hu Zhou,2011,2011 International Conference on Electric Technology and Civil Engineering (ICETCE),review;mechanical_properties;dam_engineering,OpenAlex;Crossref,10.1109/icetce.2011.5774287,https://doi.org/10.1109/icetce.2011.5774287,,"Rock filled concrete (RFC), a new type of mass concrete, has been widely used in the construction of hydraulic engineering structures in China. Due to the huge construction volume, it has to be casted layer by layer and the cold joints are produced in the RFC dams as a result. The shear capacity of this weak interface significantly affects the dam stability against sliding, but less research effort has been made on it. Benefit from the direct shear test on concrete-rock interface in the literature, the series of large size tests on the direct shear resistance of the RFC cold joints are carried out in this study. The preliminary results include the shear resistance parameters and discussion on the test methods of the RFC cold joints.",Direct shear test;Geotechnical engineering;Shear (geology);Shear strength (soil);Rock mass classification;Geology;Materials science;Structural engineering;et al.,en,2,open_access_candidate,closed,,,candidate,query=rock-filled concrete; query=rock filled concrete; query=rock-filled concrete; query=rock filled concrete
openalex_dd9b3c740c45,Test Analysis of the Cleavage and Tensile Performance of the Self-compacting Rock-filled Concrete in Weitan Hydropower Station,Song Wen-ju,2011,Shanxi Hydrotechnics,mechanical_properties,OpenAlex,,https://openalex.org/W2347215594,,"The self-compacting rock-filled concrete is used to construct Weitan Hydropower station.In order to verify the feasibility of this technique the large samples are directly cut from the self-compacting rock-filled concrete on site,then the study on the cleavage and tensile performance is conducted.The results show that the average cleavage and tensile performance is 1.75MPa.It fully meets the requirements of engineering.",Cleavage (geology);Ultimate tensile strength;Hydropower;Geotechnical engineering;Structural engineering;Engineering;Geology;Materials science;et al.,en,1,open_access_candidate,closed,,,candidate,query=rock-filled concrete; query=rock filled concrete; query=self-compacting rock-filled concrete
openalex_67718fd00648,Study on the Material Mechanical Performance of Large Scale Self-Compacting Rock-Filled Concrete,Hai Chao Wang; Jianda Xin; Xue Hui An; Xi Xu; Li Zhou,2012,Advanced materials research,mechanical_properties;dam_engineering,OpenAlex;Crossref,10.4028/www.scientific.net/amr.482-484.1362,https://doi.org/10.4028/www.scientific.net/amr.482-484.1362,,"In order to study the influence of large size aggregate on self-compacting rock-filled concrete, the compactness between self-compacting concrete (SCC) and rocks, as well as the whole workability of self-compacting rock-filled concrete, the experimental test in the present paper was carried out on the 500-ton electro-hydraulic serve testing machine and the sizes of specimens are 450mm×450mm×450mm and 450mm×450mm×900mm. The results show that the exterior damage of self-compacting rock-filled concrete specimens are different from that of standard concrete specimens; the damage sections are flat and rocks are cut through in some areas, which shows mainly bond failure at interfaces between self-compacting concrete (SCC) and rocks. The compactness inside is well and the strength of self-compacting rock-filled concrete can almost reach that of SCC, which provides theoretical basis for the application of self-compacting rock-filled concrete.",Geotechnical engineering;Aggregate (composite);Materials science;Composite material;Geology,en,5,open_access_candidate,closed,https://www.scientific.net/PolicyAndEthics/PublishingPolicies; https://www.scientific.net/license/TDM_Licenser.pdf,,candidate,query=rock-filled concrete; query=rock filled concrete; query=self-compacting rock-filled concrete; query=self-compacting rock-filled concrete
openalex_9ab11b74a7ed,堆石混凝土（RFC）在布尔津山口电站围堰方案中的设计与应用,丁照祥; 李新江; 李海涛,2012,水利建设与管理,dam_engineering,OpenAlex,,https://openalex.org/W940914289,,本文主要介绍了新疆布尔津山口电站工程施工导流围堰设计的方案拟选思路。通过比选，发现堆石混凝土（RFC）技术在施工工艺、造价上的优势。经过一个汛期的运行考验证明，堆石混凝土是一项可以在水利工程建设上应用的技术。,Computer science,zh,,open_access_candidate,closed,,,candidate,query=堆石混凝土
