source_id,title,authors,year,venue,category,discovered_via,doi,url,pdf_url,abstract,keywords,language,citation_count,source_type,access_rights,license_or_terms,local_path,status,notes
openalex_bd1b89d8837a,The Comparison of Self-Compacting Rock-Filled Concrete with Large-Size Natural and Recycled Aggregate,Hai Chao Wang; Xue Hua Wang; Xue Hui An,2014,Applied Mechanics and Materials,,OpenAlex;Crossref,10.4028/www.scientific.net/amm.513-517.20,https://doi.org/10.4028/www.scientific.net/amm.513-517.20,,"The different fracture characteristics of self-compacting rock-filled concrete with large-size natural and recycled aggregate are analyzed by three-point bending experiment. According to the analysis of the crack propagation process, the fracture mechanism differences of self-compacting rock-filled concrete with large-size natural and recycled aggregate are discussed. The further analysis of the differences of fracture toughness, fracture energy, and are gain",Aggregate (composite);Materials science;Fracture (geology);Bending;Geotechnical engineering;Composite material;Fracture toughness;Toughness;et al.,en,2,open_access_candidate,closed,https://www.scientific.net/PolicyAndEthics/PublishingPolicies; https://www.scientific.net/license/TDM_Licenser.pdf,,candidate,query=rock-filled concrete; query=rock filled concrete; query=self-compacting rock-filled concrete; query=rock-filled concrete; query=rock filled concrete; query=self-compacting rock-filled concrete
openalex_1bc55c680be6,"Experimental Study on Effects of Casting Procedures on Compressive Strength, Water Permeability, and Interfacial Transition Zone Porosity of Rock-Filled Concrete",Yiyang Wang; Feng Jin; Yuetao Xie,2016,Journal of Materials in Civil Engineering,mechanical_properties,OpenAlex,10.1061/(asce)mt.1943-5533.0001558,https://doi.org/10.1061/(asce)mt.1943-5533.0001558,,"This study investigated the effects of different casting procedures on compressive strength, water permeability, and interfacial transition zone (ITZ) porosity of rock-filled concrete (RFC). Mixes of concrete with the same proportions were cast using the self-compacting method (the casting procedure of RFC) and the vibration method (the casting procedure of normal concrete). A control group of concrete was prepared to reveal the effects of aggregate size. Compressive tests and water permeability tests were performed in accordance with the current codes. Scanning electron microscopy was used to calculate the porosity of the ITZ by processing the second electron and backscattered electron images of the ITZ. The findings indicate that the self-compacting method can improve compressive strength and particularly impermeability grade. Switching the vibration method to the self-compacting method also significantly reduces ITZ porosity, especially the ITZ porosity at the lateral surface of the aggregate.",Porosity;Compressive strength;Materials science;Composite material;Casting;Permeability (electromagnetism);Scanning electron microscope;Aggregate (composite);et al.,en,30,open_access_candidate,closed,,,candidate,query=rock-filled concrete; query=rock filled concrete; query=self-compacting rock-filled concrete
openalex_a0d62f416384,A Study on Adiabatic Temperature Rise Test and Temperature Stress Simulation of Rock-Fill Concrete,Xiaofei Zhang; Qian Liu; Xin Zhang; Yanlong Li; Xiaoping Wang,2018,Mathematical Problems in Engineering,thermal_control;numerical_modeling;dam_engineering,OpenAlex,10.1155/2018/3964926,https://downloads.hindawi.com/journals/mpe/2018/3964926.pdf,https://downloads.hindawi.com/journals/mpe/2018/3964926.pdf,"In the present study, we investigate the effect of the adiabatic temperature rise property of rock-fill concrete (RFC) on the temperature stress and crack resistance of RFC gravity dams. We conducted tests on the adiabatic temperature rise of RFC with a rock-fill ratio of 42%, 49%, and 55%, respectively. Based on the regression analysis of the test data, a calculation model of the adiabatic temperature rise, considering the rock-fill ratio, is developed, and the finite element analysis software ANSYS is employed to simulate the whole process of the temperature and temperature stress fields of a RFC gravity dam. The main findings of the study are as follows: (1) Both the adiabatic temperature rise rate and the final adiabatic temperature rise of RFC are negatively correlated with the rock-fill ratio. (2) The calculation model of the adiabatic temperature rise of RFC is characterized by its high accuracy, which can help predict the adiabatic temperature rise of RFC with different rock-fill ratios. (3) Without any temperature control measures, the maximum temperature stress of RFC generated by the temperature rise of hydration heat in the RFC gravity dam is 0.93 MPa, which meets the standard of temperature stress control. The results of the present study indicate that dam construction with RFC can simplify the measures of temperature control and crack prevention, improve the construction efficiency, and reduce the cost of dam construction.",Adiabatic process;Gravity dam;Temperature control;Materials science;Stress (linguistics);Mechanics;Structural engineering;Geotechnical engineering;et al.,en,14,open_access_candidate,hybrid,cc-by,,candidate,query=rock-filled concrete; query=rock filled concrete; query=rock-fill concrete dam
openalex_5b4c0178d435,Experimental study on the creep behaviour of rock-filled concrete and self-compacting concrete,Shiqin He; Zhongfeng Zhu; Miao Lv; Hui Wang,2018,Construction and Building Materials,dam_engineering,OpenAlex;Crossref,10.1016/j.conbuildmat.2018.07.083,https://doi.org/10.1016/j.conbuildmat.2018.07.083,,,Creep;Materials science;Shrinkage;Composite material;Geotechnical engineering;Structural engineering;Geology;Engineering,en,27,open_access_candidate,closed,https://www.elsevier.com/tdm/userlicense/1.0/; https://www.elsevier.com/legal/tdmrep-license,,candidate,query=rock-filled concrete; query=rock filled concrete; query=self-compacting rock-filled concrete; query=rock-filled concrete; query=rock filled concrete; query=self-compacting rock-filled concrete; query=self-compacting concrete prepacked rock
openalex_41ca1178b5fe,Research on Rock-Filled Concrete Dam,Feng Jin; Hu Zhou; Xuehui An,2018,International Journal of Civil Engineering,dam_engineering,OpenAlex;Crossref,10.1007/s40999-018-0313-0,https://doi.org/10.1007/s40999-018-0313-0,http://link.springer.com/content/pdf/10.1007/s40999-018-0313-0.pdf,,Geotechnical engineering;Engineering;Civil engineering;Geology;Forensic engineering,en,30,open_access_candidate,closed,http://www.springer.com/tdm,,candidate,query=rock-filled concrete; query=rock filled concrete; query=rock-fill concrete dam; query=rock-filled concrete; query=rock filled concrete
openalex_7cf3fcfc3395,Research on Rock-Filled Concrete Dams: a Review,Feng Jin; Hu Zhou; Duruo Huang,2018,EasyChair preprint,review;thermal_control;dam_engineering,OpenAlex;Crossref,10.29007/tjdq,https://easychair.org/publications/preprint_open/Hdvz,https://easychair.org/publications/preprint_open/Hdvz,"Rock-Filled Concrete (RFC) is an innovative mass concrete technology. To date, RFC technology has been used to build a great number of gravity dams and arch dams. Since it was invented in 2003, many experimental and numerical research works have been conducted. During the construction process of RFC, an assembly of large rocks with more than 300 mm in grain size, called rockfill, can be cemented with a high-performance self-compacting concrete (HSCC). The RFC technology combines the advantages of masonry and concrete, in that it decreases cement consumption, lowers temperature rise of cement hydration, and reduces shrinkage of concrete. This paper aims at acquainting readers with a timely review of state-of-the-art research on RFC technology, including (1) workability of HSCC and compactness of RFC, (2) thermal and mechanical properties of RFC, (3) structures of an RFC dam and (4) construction and quality control measurements.",Cement;Shrinkage;Geotechnical engineering;Experimental research;Civil engineering;Engineering;Geology;Materials science;et al.,en,13,open_access_candidate,diamond,,,candidate,query=rock-filled concrete; query=rock filled concrete; query=rock-fill concrete dam; query=self-compacting rock-filled concrete; query=rock-filled concrete; query=rock filled concrete
openalex_f71e2ed8a02c,Study on Rock Filled Self Compacting Concrete,Arun Raja L.; Dr.M. Shahul Hameed,2018,Zenodo (CERN European Organization for Nuclear Research),filling_capacity;mechanical_properties;dam_engineering,OpenAlex,10.5281/zenodo.2416888,https://zenodo.org/record/2416888,https://zenodo.org/record/2416888,"<em>In large-scale concrete construction of Rock-filled concrete (RFC) was recently developed. The filling capacity of self-compacting concrete (SCC) makes it highly dependent on distinctive casting procedure of RFC. </em><em>This research examined the most controversial issues regarding performance of SCC and Rock Filled Concrete (RFC). An experimental setup designed to arouse SCC flow in rock skeleton were investigated. The slump cone, L-Box, J-Ring, and V-Funnel tests were carried out on the fresh Self Compacting Concrete with the EFNARC guidelines. After each mix proportion, specimens were casted and cured for 28 days in water and compressive strength and split tensile values were determined. The result show that</em><em> the strengths found better for </em><em>SCC with Rock filled concrete.eng</em>",Geology; Geotechnical engineering; Materials science,en,,open_access_candidate,green,other-oa,,candidate,query=self-compacting rock-filled concrete
openalex_1a5962fe4e65,Experimental Research on the Properties of Rock-Filled Concrete,Hai Wei; Guohui Zhang; Fanfan Sun; Mingming Wang; Wenhai Li; Juncai Xu,2019,Applied Sciences,mechanical_properties;dam_engineering,OpenAlex;Crossref,10.3390/app9183767,https://www.mdpi.com/2076-3417/9/18/3767/pdf,https://mdpi-res.com/d_attachment/applsci/applsci-09-03767/article_deploy/applsci-09-03767.pdf,"In order to comprehensively evaluate the properties of rock-filled concrete (RFC) with the strength of C15, lab experimental test and in-situ test are applied to explore the mechanical, hydraulic, ultrasonic characteristics of RFC in Hantang reservoir dam. Four types of defects within RFC are shown from the appearance of borehole cores specimens: (1) large sized voids existing in interfacial transition zone (ITZ) between self-compacting concrete (SCC) and rock block (RB); (2) bad cohesion in ITZ; (3) joints within rock block; (4) voids within SCC. For hydraulic aspects, the average porosity of RFC is 14.10%; the permeability rate of RFC ranges from 2.41 Lu to 10.41 Lu, with the average of 11.32 Lu, occasionally more than 25.52 Lu due to interconnected defects. For ultrasonic aspects, the ultrasonic velocity of RFC conforms to lognormal distribution, with the average of 2993.3 m/s and standard deviation of 650.5 m/s. For mechanical aspects, the average cubic compressive strength of RFC is 22.55 Mpa, with the standard deviation of 4.09 Mp. Thus the data shows a relatively great dispersion due to uneven distribution of some defects in RFC, which deteriorate the quality of RFC. Through the experimental investigation, it is shown that the quality of massive RFC in the Hantang dam is obviously non-homogeneous, mainly influenced by construction technology.",Materials science;Porosity;Geotechnical engineering;Homogeneous;Composite material;Compressive strength;Geology;Mathematics;et al.,en,14,open_access_candidate,gold,cc-by,,candidate,query=rock-filled concrete; query=rock filled concrete; query=rock-fill concrete dam; query=self-compacting rock-filled concrete; query=rock-filled concrete; query=rock filled concrete
openalex_1483452076b4,Experimental study of the influence of rocks on the interlayer shear behavior of rock-filled concrete,Mingqian Ren; AN Xuehui; Tan Ni; Pengfei Li,2019,Journal of Tsinghua University(Science and Technology),,OpenAlex,10.16511/j.cnki.qhdxxb.2019.22.029,https://doi.org/10.16511/j.cnki.qhdxxb.2019.22.029,,,Geotechnical engineering;Shear (geology);Materials science;Composite material;Direct shear test;Geology,en,3,open_access_candidate,closed,,,candidate,query=rock-filled concrete; query=rock filled concrete
openalex_913323cb4cb2,Filling Capacity Evaluation of Self-Compacting Concrete in Rock-Filled Concrete,W. Liu; Jianwen Pan,2019,Materials,filling_capacity;numerical_modeling,OpenAlex;Crossref,10.3390/ma13010108,https://www.mdpi.com/1996-1944/13/1/108/pdf?version=1577274421,https://mdpi-res.com/d_attachment/materials/materials-13-00108/article_deploy/materials-13-00108.pdf,"The good filling performance of self-compacting concrete (SCC) to pre-placed assembly of rocks is essential for quality of rock-filled concrete (RFC). In this study, a theoretical model is proposed to evaluate the filling capacity of SCC in porous media that is simplified to approximate the assembly of rocks. Numerical simulation of SCC flow in the porous media is carried out based on the computational fluid dynamics. The effects of yield stress of SCC and size and shape of grains in the porous media on the filling capacity of SCC are considered. The inclination of the free surface of the distribution of SCC at flow stoppage is defined to evaluate the filling capacity of SCC in the porous media. According to the theoretical model, the inclination is directly proportional to the yield stress of the SCC and the blocking effect of grains, while inversely proportional to the grain size. The numerical simulation provides consistent results with the theoretical model. The results suggest the use of rounded large rocks and SCC with low yield stress to ensure good quality of RFC.",Porous medium;Geotechnical engineering;Materials science;Yield (engineering);Porosity;Computer simulation;Yield surface;Flow (mathematics);et al.,en,30,open_access_candidate,gold,cc-by,,candidate,query=rock-filled concrete; query=rock filled concrete; query=self-compacting rock-filled concrete; query=rock-filled concrete; query=rock filled concrete; query=self-compacting rock-filled concrete; query=self-compacting concrete prepacked rock
openalex_af09d90a94c7,Filling capacity analysis of self-compacting concrete in rock-filled concrete based on DEM,Xuan Zhang; Zhihua Zhang; Zhida Li; Yunyu Li; Sun Tingting,2019,Construction and Building Materials,filling_capacity;numerical_modeling;dam_engineering,OpenAlex;Crossref,10.1016/j.conbuildmat.2019.117321,https://doi.org/10.1016/j.conbuildmat.2019.117321,,,Void ratio;Materials science;Geotechnical engineering;Mortar;Void (composites);Discrete element method;Slump;Composite material;et al.,en,50,open_access_candidate,closed,https://www.elsevier.com/tdm/userlicense/1.0/; https://www.elsevier.com/legal/tdmrep-license,,candidate,query=rock-filled concrete; query=rock filled concrete; query=self-compacting rock-filled concrete; query=rock-filled concrete; query=rock filled concrete; query=self-compacting rock-filled concrete; query=self-compacting concrete prepacked rock
openalex_d0c45fd53da2,Lattice Boltzmann-Discrete Element Modeling Simulation of SCC Flowing Process for Rock-Filled Concrete,Songgui Chen; Chuan-Hu Zhang; Feng Jin; Peng Cao; Qicheng Sun; Changjun Zhou,2019,Materials,filling_capacity;numerical_modeling,OpenAlex;Crossref,10.3390/ma12193128,https://www.mdpi.com/1996-1944/12/19/3128/pdf?version=1569487945,https://mdpi-res.com/d_attachment/materials/materials-12-03128/article_deploy/materials-12-03128.pdf,"Since invented in 2003, rock-filled concrete (RFC) has gained much attention and has been successfully applied in more and more civil and hydraulic projects in China. This study developed a numerical framework to simulate self-compacting concrete (SCC) flows in the voids among rocks of RFC, which couples the lattice Boltzmann method and discrete element method (DEM). The multiple-relaxation-time scheme is used to simulate self-compacting mortar (SCM) for better stability while the motion of coarse aggregates in SCC is simulated with DEM. The immersed moving boundary method is incorporated to deal with the interactions between coarse aggregates and SCM. After validation, the coupled framework is applied to study SCC flows in a single channel and in porous media with multi-channels. A passing factor PF was proposed and calculated to describe quantitatively the passing ability of SCC through a single channel. The study found that jamming of SCC occurs when the ratio Ar of the gap width to particle diameter is smaller than 2.0 and the jamming risk increases with solid particles fraction while the passing ability has a weak relation with the pressure gradient. Further, SCC flow is self-tuning in porous media with multi-channels and it is prone to go through larger or wider gaps. Exceeded existence of narrow gaps will significantly increase the jamming risk.",Discrete element method;Jamming;Lattice Boltzmann methods;Porous medium;Materials science;Mechanics;Mortar;Porosity;et al.,en,17,open_access_candidate,gold,cc-by,,candidate,query=rock-filled concrete; query=rock filled concrete; query=self-compacting rock-filled concrete; query=rock-filled concrete; query=rock filled concrete
openalex_a1d6a02feb6e,Mechanical Behavior of Cemented Granular Aggregates under Uniaxial Compression,Wei Wang; Jianwen Pan; Feng Jin,2019,Journal of Materials in Civil Engineering,mechanical_properties,OpenAlex,10.1061/(asce)mt.1943-5533.0002681,https://doi.org/10.1061/(asce)mt.1943-5533.0002681,,"Cemented granular aggregates composed of densely packed particles bound together by a matrix partially filling the interstitial pore space, connecting adjacent grains and forming cemented grain-to-grain contacts. The artificial cemented granular aggregates from the high alumina ceramics beads as particles and self-compacting cement paste as cement matrix are used to investigate the mechanical behavior under uniaxial compression testing. The samples are fabricated by using the technique of rock-filled concrete without disturbing the granular backbone. The results show that the elastic modulus of the cemented granular aggregates is nearly four times or even one order of magnitude higher than that of the cement matrix. It is found that a linear-elastic regime is a dominant behavior in the prepeak region, and strain-softening is accompanied by the strain-hardening after the peak strength. Both decreasing the matrix volume fraction and reducing the matrix strength make the strain-hardening behavior disappeared. Interestingly, the uniaxial compressive strength and elastic modulus are found to be a nonlinear function of the matrix volume fraction, whatever the strength of cement matrix. The strength increases rapidly with a relative small value of matrix volume fraction. The bulk effect of matrix on the compressive strength and elastic modulus becomes more significant beyond a critical threshold value.",Materials science; Composite material; Compressive strength; Elastic modulus; Hardening (computing); Cement; Volume fraction; Softening; et al.,en,19,open_access_candidate,closed,,,candidate,query=self-compacting rock-filled concrete
openalex_71226e12aac3,Pilot Study on Vibrated Rock-filled Concrete,Bohao Wang; Feng Jin; Hu Zhou; Duruo Huang; Ning Liu; Wei Wang; Yiyang Wang,2019,Journal of Advanced Concrete Technology,filling_capacity;thermal_control,OpenAlex;Crossref,10.3151/jact.17.559,https://www.jstage.jst.go.jp/article/jact/17/10/17_559/_pdf,https://www.jstage.jst.go.jp/article/jact/17/10/17_559/_pdf,"This exploratory study investigated a new type of rock-filled concrete (RFC) named vibrated rock-filled concrete (VRFC). Different from the self-compacting concrete (SCC) used in traditional type of RFC, VRFC was built with ordinary pumping concrete (OPC) with the help of external vibration. The application of OPC further reduced the cement dosage and hydration heat of RFC, making it more widely applicable and environment-friendly without cost increase. It was proved that the fluidity of OPC could be significantly improved by external vibration, and the relationship between the flowing process and the mix proportion of OPC was also analyzed in the laboratory experiment. After verifying the feasibility of filling the rock voids with OPC in the laboratory, more than 700 m3 VRFC was constructed in the on-site experiment with roller compactors as the vibration source. Panoramic borehole color TV system and ultrasonic testing method were used to evaluate the quality of VRFC, and the influences of different parameters on the compactness as well as mechanical performance of VRFC were also analyzed.",Cement;Borehole;Vibration;Structural engineering;Materials science;Types of concrete;Geotechnical engineering;Engineering;et al.,en,7,open_access_candidate,diamond,,,candidate,query=rock-filled concrete; query=rock filled concrete; query=self-compacting rock-filled concrete; query=rock-filled concrete; query=rock filled concrete
openalex_da2b7b5e56bc,Construction information management system for rock-filled concrete dam (CIM4R),Xiaorong Xu; Feng Jin; Liqun Fu; Hu Zhou,2021,,dam_engineering,OpenAlex,10.1109/ichceswidr54323.2021.9656283,https://doi.org/10.1109/ichceswidr54323.2021.9656283,,"Rock-Filled Concrete (RFC) dam is a new type of concrete dam based on the technology of self-compacting concrete (SCC). To improve the quality control of construction in RFC dam site, a construction information management system for RFC dams (CIM4R) was developed. The software system has two user interfaces. The first is WEB based user interface for PCs, which takes control of the basic project information, the user authorization and data statistical analysis. The second is WeChat based user interface for mobile phones, which is assigned to users for the work stage control, information collection, message notification, and on-site record. Several modules are increasingly developed in the management system, such as inventory and inspection of raw materials, production control in the mixing plant, testing concrete specimens, quality inspection of unit engineering, and so on. AliCloud platform provides the platform for the storage of engineering data.",Authorization;Interface (matter);Computer science;User interface;Control (management);Quality (philosophy);Database;Engineering;et al.,en,1,open_access_candidate,closed,,,candidate,query=rock-filled concrete; query=rock filled concrete; query=rock-fill concrete dam; query=self-compacting rock-filled concrete
openalex_cd6672ea6eb8,Experimental investigation into mode-I interfacial fracture behavior between rock and self-compacting concrete in rock-filled concrete,Jialong He; Hexiao Huang; Hui Jiang; Yuande Zhou; Feng Jin; Chuhan Zhang,2021,Engineering Fracture Mechanics,mechanical_properties,OpenAlex;Crossref,10.1016/j.engfracmech.2021.108047,https://doi.org/10.1016/j.engfracmech.2021.108047,,,Materials science;Composite material;Fracture (geology);Ultimate tensile strength;Softening;Wedge (geometry);Geotechnical engineering;Surface finish;et al.,en,28,open_access_candidate,closed,https://www.elsevier.com/tdm/userlicense/1.0/; https://www.elsevier.com/legal/tdmrep-license; https://doi.org/10.15223/policy-017; https://doi.org/10.15223/policy-037; https://doi.org/10.15223/policy-012; https://doi.org/10.15223/policy-029; https://doi.org/10.15223/policy-004,,candidate,query=rock-filled concrete; query=rock filled concrete; query=self-compacting rock-filled concrete; query=rock-filled concrete; query=rock filled concrete; query=self-compacting rock-filled concrete; query=self-compacting concrete prepacked rock
openalex_7f5a51b6bc3c,Field prototype experiment of rockfill temperature before SCC filling for rock-filled concrete dam,Shunyao Yu; Liu-Chao Qiu; Xiaorong Xu; Feng Jin,2021,,thermal_control;numerical_modeling;dam_engineering,OpenAlex,10.1109/ichceswidr54323.2021.9656422,https://doi.org/10.1109/ichceswidr54323.2021.9656422,,"The estimation of the rockfill temperature in practical engineering is of great significance to calculate the temperature rise of rock-filled concrete. Through the field prototype experiments of monitoring the rockfill temperature, the non-uniform temperature field along with the seasonal distribution was analyzed by qualitative and quantitative approaches. When the rockfill in a lift surface is treated as an equivalent ‘rock’ with porous structure, some results were manifested that: (1) The temperature of the exposed rockfill is more susceptible to the air (solar radiation and convection etc.), which results in the heterogeneity and seasonal variability; (2) The estimation of the rockfill temperature can be roughly conducted by its relationship with the air temperature. (3) The influence of the air temperature on the rockfill is nearly linear with the depth, and the thermal conductivity can be estimated for the future numerical simulations. Further work is in process for the mechanism of heat conduction between rockfill and SCC.",Geotechnical engineering; Field (mathematics); Geology; Materials science; Mathematics; Pure mathematics,en,,open_access_candidate,closed,,,candidate,query=rock-fill concrete dam
crossref_54fa3fc970a1,Influence of fly ash dosage over the compressive strength of rock-filled concrete,,2021,Functional Materials,mechanical_properties,Crossref,10.15407/fm29.02.274,https://doi.org/10.15407/fm29.02.274,,,,en,0,open_access_candidate,metadata,,,candidate,query=rock-filled concrete; query=rock filled concrete
